{
  "schemaVersion": 1,
  "id": "know-your-dance-prompts",
  "provider": "compositing",
  "default": "somana-kunitha",
  "sets": {
    "somana-kunitha": {
      "label": "Somana Kunitha guardian mask",
      "mask": {
        "asset": "assets/masks/generated/somana-kunitha-01.png",
        "anchor": "head",
        "scale": 1.18,
        "offsetY": -0.02,
        "opacity": 0.98,
        "prompt": "large red guardian mask inspired by Somana Kunitha"
      }
    },
    "chau": {
      "label": "Chau heroic mask",
      "mask": {
        "asset": "assets/masks/generated/chau-01.png",
        "anchor": "head",
        "scale": 1.22,
        "offsetY": -0.08,
        "opacity": 0.98,
        "prompt": "dramatic heroic mask inspired by Chau dance"
      }
    },
    "bardo-chham": {
      "label": "Bardo Chham animal mask",
      "mask": {
        "asset": "assets/masks/generated/bardo-chham-01.png",
        "anchor": "head",
        "scale": 1.16,
        "offsetY": -0.03,
        "opacity": 0.98,
        "prompt": "colorful animal mask inspired by Bardo Chham"
      }
    },
    "gomira": {
      "label": "Gomira fierce mask",
      "mask": {
        "asset": "assets/masks/generated/gomira-01.png",
        "anchor": "head",
        "scale": 1.2,
        "offsetY": -0.02,
        "opacity": 0.98,
        "prompt": "fierce wooden mask inspired by Gomira"
      }
    }
  }
}
